{
  "version": "1.0.0",
  "updated_at": "2026-10-15",
  "default_aspect_ratio": "1:1",
  "videos": [
    {
      "slug": "greatvibe-first-screen-recording",
      "title": "GreatVibe First Screen Recording",
      "summary": "A first walkthrough recording for orienting a user in the GreatVibe experience.",
      "provider": "vimeo",
      "video_id": "1214761385",
      "embed_hash_ref": "greatvibe-first-screen-recording",
      "source_url": "https://vimeo.com/1214761385",
      "aspect_ratio": "1:1",
      "product_area": "mochi-onboarding",
      "audience": [
        "new-users",
        "mochi-users"
      ],
      "difficulty": "intro",
      "trust": "owned",
      "visibility": "unlisted-overlay-required",
      "tags": [
        "welcome",
        "first-session",
        "mochi",
        "onboarding",
        "gvturn"
      ],
      "related_docs": [
        "../getting-started/welcome-to-greatvibe.md",
        "../getting-started/first-10-minutes.md",
        "../concepts/what-is-a-gvturn.md"
      ],
      "transcript_path": "transcripts/greatvibe-first-screen-recording.md",
      "chapters": [
        {
          "start_seconds": 0,
          "title": "Welcome and orientation"
        }
      ],
      "updated_at": "2026-08-03"
    },
    {
      "slug": "greatvibe-welcome",
      "title": "greatVibe Guest Tour: Prompts, Agent IQ and Turn Cards",
      "summary": "Johnathon introduces the guest console, prompts and Agent IQ, Mochi and development nodes, Sealed Secrets, Interactions, credentials and reviewing work. The 12:14 tour accompanies the synthetic guest demo; stop the demo before sending a real request.",
      "provider": "vimeo",
      "video_id": "1236068377",
      "embed_hash_ref": "greatvibe-welcome",
      "source_url": "https://vimeo.com/1236068377",
      "aspect_ratio": "1:1",
      "product_area": "mochi-onboarding",
      "audience": [
        "new-users",
        "mochi-users"
      ],
      "difficulty": "intro",
      "trust": "owned",
      "visibility": "unlisted-overlay-required",
      "tags": [
        "welcome",
        "mochi",
        "onboarding",
        "first-login",
        "agent-iq",
        "demo",
        "sealed-secrets",
        "nodes"
      ],
      "related_docs": [
        "../how-to/watch-the-guest-tour.md",
        "../getting-started/ask-mochi-for-help.md",
        "../concepts/what-is-a-node.md",
        "../how-to/use-gvturn-actions.md",
        "../reference/plans-and-pricing.md"
      ],
      "transcript_path": "transcripts/greatvibe-welcome.md",
      "chapters": [
        {
          "start_seconds": 0,
          "title": "Welcome and guest console"
        },
        {
          "start_seconds": 68,
          "title": "Prompts and Agent IQ"
        },
        {
          "start_seconds": 167,
          "title": "Mochi nodes and live work"
        },
        {
          "start_seconds": 342,
          "title": "Sealed Secrets"
        },
        {
          "start_seconds": 459,
          "title": "Interactions and steering"
        },
        {
          "start_seconds": 560,
          "title": "Credentials history and next steps"
        }
      ],
      "updated_at": "2026-10-15",
      "duration_seconds": 734
    },
    {
      "slug": "greatvibe-story",
      "title": "Take on more. Stay in control.",
      "summary": "David Jenkinson, CEO of greatVibe by Gravient, explains why better AI needs an engineering environment that keeps context, evidence and human judgment with the work.",
      "provider": "vimeo",
      "video_id": "1235643218",
      "embed_hash_ref": "greatvibe-story",
      "aspect_ratio": "16:9",
      "duration_seconds": 426,
      "product_area": "welcome",
      "audience": [
        "new-users",
        "developers",
        "founders"
      ],
      "difficulty": "intro",
      "trust": "owned",
      "visibility": "unlisted-overlay-required",
      "tags": [
        "welcome",
        "story",
        "david",
        "directed-ai",
        "production-discipline"
      ],
      "related_docs": [
        "getting-started/why-we-built-greatvibe.md",
        "reference/plans-and-pricing.md"
      ],
      "transcript_path": "transcripts/greatvibe-story.md",
      "chapters": [
        {
          "start_seconds": 0,
          "title": "The capability of coding agents"
        },
        {
          "start_seconds": 25,
          "title": "Keeping the work under control"
        },
        {
          "start_seconds": 53,
          "title": "Why we built greatVibe"
        },
        {
          "start_seconds": 96,
          "title": "Seeing what changed and why"
        },
        {
          "start_seconds": 159,
          "title": "Production discipline"
        },
        {
          "start_seconds": 181,
          "title": "Intent, evidence and human judgment"
        },
        {
          "start_seconds": 215,
          "title": "Taking engineering into production"
        },
        {
          "start_seconds": 263,
          "title": "Connected tools, projects and nodes"
        },
        {
          "start_seconds": 315,
          "title": "Who greatVibe is for"
        },
        {
          "start_seconds": 372,
          "title": "Try a piece of real work"
        }
      ],
      "updated_at": "2026-10-14"
    },
    {
      "slug": "greatvibe-mobile-tips",
      "title": "Complex Turns on Mobile: greatVibe on Galaxy Z Fold7",
      "summary": "Johnathon uses the greatVibe PWA on a Galaxy Z Fold7 to edit Turn Card actions, add images, explain Tandem Turns, inspect Agent IQ spaces, follow support and builds, steer work and review changes. An optional 24:22 screen recording, separate from the guest demo.",
      "provider": "vimeo",
      "video_id": "1236054521",
      "embed_hash_ref": "greatvibe-mobile-tips",
      "source_url": "https://vimeo.com/1236054521",
      "aspect_ratio": "9:10",
      "duration_seconds": 1462,
      "product_area": "dashboard-console",
      "audience": [
        "users",
        "developers"
      ],
      "difficulty": "intermediate",
      "trust": "owned",
      "visibility": "unlisted-overlay-required",
      "tags": [
        "mobile",
        "pwa",
        "galaxy-z-fold7",
        "turn-cards",
        "agent-iq",
        "steering",
        "tandem-turns",
        "support",
        "review"
      ],
      "related_docs": [
        "../how-to/work-with-complex-turns-on-mobile.md",
        "../how-to/use-gvturn-actions.md",
        "../how-to/use-tandem-turns.md",
        "../how-to/steer-a-running-turn.md",
        "../how-to/report-and-follow-support-requests.md"
      ],
      "transcript_path": "transcripts/greatvibe-mobile-tips.md",
      "chapters": [
        {
          "start_seconds": 0,
          "title": "Turn Cards and recommended actions"
        },
        {
          "start_seconds": 125,
          "title": "Hold to edit and the prompt composer"
        },
        {
          "start_seconds": 193,
          "title": "Inline images and clear instructions"
        },
        {
          "start_seconds": 256,
          "title": "Co-write with Tandem Turns"
        },
        {
          "start_seconds": 317,
          "title": "Send the prompt and read Agent IQ"
        },
        {
          "start_seconds": 400,
          "title": "Fullscreen and choosing spaces"
        },
        {
          "start_seconds": 501,
          "title": "Read Architecture and Patterns"
        },
        {
          "start_seconds": 673,
          "title": "Handle support while work continues"
        },
        {
          "start_seconds": 927,
          "title": "Follow builds pipelines and file changes"
        },
        {
          "start_seconds": 1046,
          "title": "Inspect Topology and workers"
        },
        {
          "start_seconds": 1164,
          "title": "Steer work across authorized nodes"
        },
        {
          "start_seconds": 1347,
          "title": "Deploy and verify the work"
        },
        {
          "start_seconds": 1414,
          "title": "Review changes and wrap up"
        }
      ],
      "updated_at": "2026-10-15"
    }
  ]
}
